<!ELEMENT BOOKS (BOOK+)>
<!ELEMENT BOOK (NAME, AUTHOR, ISBN, PRICE, PUBLISHER)>
<!ELEMENT NAME (#PCDATA) >
<!ELEMENT AUTHOR (#PCDATA) >
<!ELEMENT ISBN (#PCDATA) >
<!ELEMENT PRICE (#PCDATA) >
<!ELEMENT PUBLISHER (#PCDATA) >